{"schema_version":1,"mode":"demo","generated_utc":"2026-10-19T12:00:00Z","as_of_utc":"2026-10-19T12:00:00Z","source":"demo-generator","trading_enabled":false,"engine":{"baseline":"V7.2.1 (frozen)","simulator":"V7.3.1 (proposal)","validation":"WAIT"},"timeframes":["M1","M5","M15","H1","H4"],"disclaimers":["DEMO DATA: synthetic prices, trades and results. Not live, not investment advice.","No broker connection. Live trading is not implemented in this build.","Simulated results are not evidence of a profitable strategy."],"symbols":[{"symbol":"XAUUSD","asset_class":"metal","digits":2,"pip_size":0.01,"pip_value_per_lot_usd":1,"spread_floor_pips":40,"max_spread_pips":80,"min_stop_pips":160,"max_spread_r":0.25},{"symbol":"EURUSD","asset_class":"fx_major","digits":5,"pip_size":0.0001,"pip_value_per_lot_usd":10,"spread_floor_pips":1,"max_spread_pips":2,"min_stop_pips":5,"max_spread_r":0.25},{"symbol":"GBPUSD","asset_class":"fx_major","digits":5,"pip_size":0.0001,"pip_value_per_lot_usd":10,"spread_floor_pips":1.2,"max_spread_pips":2.5,"min_stop_pips":6,"max_spread_r":0.25},{"symbol":"GBPJPY","asset_class":"fx_cross","digits":3,"pip_size":0.01,"pip_value_per_lot_usd":6.5,"spread_floor_pips":1.2,"max_spread_pips":3,"min_stop_pips":6,"max_spread_r":0.25}]}
